{
  "$schema": "http://json-schema.org/draft-07/schema#",
  "$ref": "#/definitions/ProductImage",
  "definitions": {
    "ProductImage": {
      "description": "Represents an image associated with a product",
      "type": "object",
      "additionalProperties": true,
      "required": [
        "id",
        "imageId"
      ],
      "properties": {
        "id": {
          "anyOf": [
            {
              "type": "string"
            },
            {
              "type": "null"
            }
          ],
          "description": "Unique identifier for the entity, can be null on create if auto-generated"
        },
        "imageId": {
          "type": "string",
          "description": "Reference to the actual image definition"
        },
        "imageGroupId": {
          "type": "string",
          "description": "Reference to the image group"
        },
        "imageViewType": {
          "type": "string",
          "description": "Classification of the image view, such as Large or Small icon"
        },
        "isDefaultImage": {
          "anyOf": [
            {
              "type": "boolean"
            },
            {
              "type": "null"
            }
          ],
          "description": "True if the image is the default one for the product, false otherwise"
        },
        "auditInfo": {
          "type": "object",
          "description": "Audit information for the entity",
          "additionalProperties": true,
          "required": [
            "createdBy",
            "isDeleted",
            "updatedBy",
            "updatedDate",
            "createdDate"
          ],
          "properties": {
            "createdDate": {
              "anyOf": [
                {
                  "type": "string",
                  "format": "date-time"
                },
                {
                  "type": "null"
                }
              ],
              "description": "Timestamp of when the entity was created"
            },
            "createdBy": {
              "type": "string",
              "description": "Identifies the system or user which created the entity"
            },
            "updatedDate": {
              "anyOf": [
                {
                  "type": "string",
                  "format": "date-time"
                },
                {
                  "type": "null"
                }
              ],
              "description": "Timestamp of when the entity was last updated"
            },
            "updatedBy": {
              "type": "string",
              "description": "Identifies the system or user which last updated the entity"
            },
            "isDeleted": {
              "anyOf": [
                {
                  "type": "boolean"
                },
                {
                  "type": "null"
                }
              ],
              "description": "Indicates whether or not the entity has been soft-deleted"
            }
          }
        }
      }
    }
  }
}