{
  "id": "672f0064-bfcc-46c2-a336-2775d9906f0a",
  "imageId": "09895999-e987-4048-8a0f-59d52f8a6cdd",
  "imageGroupId": "",
  "imageViewType": "Small",
  "isDefaultImage": true,
  "auditInfo": {
    "createdDate": "2023-12-12T19:24:05Z",
    "createdBy": "Application Admin",
    "updatedDate": "2023-12-12T19:24:05Z",
    "updatedBy": "Application Admin",
    "isDeleted": true
  }
}